priority,category,policy_title,recommendation,rationale,data_evidence,target_stakeholders,implementation_actions,budget_estimate,timeline,expected_impact,success_metrics,risks,mitigation
CRITICAL,Seasonal Agricultural Export Enhancement,Q3 Agricultural Export Maximization Strategy,Establish Rwanda as a reliable seasonal supplier for Food & Live Animals sector through coordinated Q3 production capacity enhancement,Data shows consistent Q3 demand surge with predictable export window. Current underutilization of this seasonal opportunity represents significant revenue loss.,Q3 consistently shows highest export volumes in agricultural sector with 35-45% premium over other quarters,"['Ministry of Agriculture and Animal Resources (MINAGRI)', 'National Agricultural Export Development Board (NAEB)', 'Farmer Cooperatives and Associations', 'Rwanda Agriculture and Animal Resources Development Board (RAB)']","['Pre-Q3 production planning and coordination with farmer cooperatives', 'Establish cold chain infrastructure for post-harvest handling', 'Create Q3 export financing windows with preferential rates', 'Develop seasonal export certification fast-track system']",$15-20M annually,"Phase 1: 6 months (pilot), Phase 2: 12 months (scale)",Increase Q3 agricultural exports by 30-40% ($50-70M annual revenue),"['Q3 export volume increase to 40% of annual total', 'Farmer participation rate in seasonal programs: 60%', 'Post-harvest losses reduced below 15%']","Weather dependency, market price volatility","Weather insurance schemes, forward contracts with buyers"
CRITICAL,Export Incentive Framework,Comprehensive Export Incentive and Tax Reform Package,Implement targeted fiscal incentives for high-growth commodity sectors and export-oriented SMEs,Strategic tax incentives can accelerate export growth in proven high-potential sectors while reducing barriers for new exporters,Top 5 commodities represent 65% of export value but face 18-25% effective tax burden,"['Ministry of Finance and Economic Planning (MINECOFIN)', 'Rwanda Revenue Authority (RRA)', 'Private Sector Federation (PSF)', 'Rwanda Development Board (RDB)']","['VAT exemption on export-oriented raw materials and equipment', 'Export credit guarantee scheme (minimum $100M fund)', '5-year tax holiday for new value-added export ventures', 'Accelerated depreciation for export processing infrastructure', 'Duty drawback scheme for imported inputs used in exports']","$25-35M in forgone revenue, $100M guarantee fund",12 months for legislative approval and implementation,"25% increase in value-added exports, 40% growth in SME exporters","['Number of new export-oriented businesses: +200 annually', 'Export credit utilization rate: 75%', 'Tax incentive ROI: 4:1 (revenue gained vs forgone)']","Revenue loss, potential abuse of incentives","Strict eligibility criteria, regular audits, sunset clauses"
HIGH,Market Diversification and Risk Reduction,Strategic Market Diversification Initiative,Reduce dependency on top 3 markets (currently 72% concentration) through targeted market entry programs,HHI of 2365.8 indicates moderate-high concentration risk. Over-reliance on few markets exposes Rwanda to political and economic shocks,Top 3 markets account for 72% of exports; market loss scenario could impact 40% of export revenue,"['Ministry of Trade and Industry (MINICOM)', 'Rwanda Development Board (RDB)', 'Export Promotion Agencies', 'Rwanda Diplomatic Missions']","['Bilateral trade agreement negotiations with 10 priority markets', 'Establish Rwanda Trade Houses in emerging markets (Asia, Latin America)', 'Market intelligence units in embassies for trade opportunities', 'B2B matching platform connecting Rwandan exporters to global buyers', 'Trade missions and expo participation (minimum 12 annually)']",$8-12M annually,"18-24 months for infrastructure, ongoing operations","Reduce HHI below 1500, increase trading partners by 20-30 countries","['HHI reduction to <1500 within 24 months', 'New market penetration: 15+ countries', 'Export distribution: No single market >25% of total']","New market entry costs, regulatory barriers in target markets","Market feasibility studies, phased approach, partner with local distributors"
HIGH,Value Chain Development,National Value Addition and Processing Infrastructure Program,"Invest in modern processing, packaging, and cold chain infrastructure to enable year-round value-added exports",Rwanda exports primarily raw commodities with minimal value addition. Processing infrastructure enables premium pricing and extended export seasons,Value-added products command 40-60% price premium; current processing capacity utilization only 35%,"['Ministry of Trade and Industry (MINICOM)', 'SME Development Board', 'Private Sector Federation (PSF)', 'Development Partners and DFIs']","['Establish 5 regional agro-processing hubs with modern equipment', 'Cold chain network covering all major production zones', 'Packaging and labeling certification centers', 'Shared-use processing facilities for SMEs', 'Quality testing laboratories (ISO certified)', 'Technology transfer programs for processing techniques']","$50-70M (PPP model: 40% public, 60% private)",24-36 months for full implementation,"25% increase in value-added exports, 15% reduction in post-harvest losses","['Value-added products: 40% of total exports by value', 'Processing capacity utilization: 75%', 'SME access to processing facilities: 500+ businesses']","High capital costs, technology obsolescence, capacity underutilization","PPP model for risk-sharing, demand studies, flexible multi-commodity facilities"
HIGH,Strategic Market Penetration,Tier 1 Powerhouse Markets Accelerated Entry Program,"Focus resources on proven high-growth markets (UAE, Ethiopia, India, China) with targeted market entry strategies",These markets show average 170% growth rate with proven market access. Strategic focus can maximize short-term revenue gains,"Tier 1 markets (UAE, Ethiopia, India, China) demonstrate 170% average growth with existing trade relationships","['Ministry of Foreign Affairs (MINAFFET)', 'Rwanda Development Board (RDB)', 'Export Promotion Agencies', 'Private Sector Exporters']","['Fast-track certification for priority market requirements', 'Market-specific product adaptation support', 'Co-financing for market entry costs (50% subsidy)', 'Dedicated trade attachés in target markets', 'Virtual trade platforms for continuous buyer engagement']",$10-15M over 2 years,"6-12 months for quick wins, 18 months for full penetration",Capture additional $500M in exports within 24 months,"['Export value to Tier 1 markets: +$500M by year 2', 'Number of exporters in these markets: +150', 'Market penetration rate: 30% of target buyers']","Regulatory changes in target markets, competition from other suppliers","Diversified product portfolio, long-term buyer relationships, quality differentiation"
MEDIUM,Youth and SME Export Engagement,Youth-Led Export Entrepreneurship and SME Capacity Building Program,Create comprehensive support ecosystem for youth entrepreneurs and SMEs to participate in export economy,Youth unemployment at 21%; SMEs represent 98% of businesses but only 30% of exporters. Untapped potential for inclusive growth,Youth (18-35) account for <15% of export entrepreneurs; SMEs face 65% failure rate in export attempts,"['Ministry of Youth and Culture (MIYOUTH)', 'Private Sector Federation (PSF)', 'Business Development Fund (BDF)', 'Youth Connekt Rwanda']","['Export entrepreneurship training programs (target: 5,000 youth annually)', 'Technology transfer and digital skills development', 'Access to international market intelligence platforms', 'Mentorship programs pairing youth with experienced exporters', 'SME export readiness assessment and capacity building', 'Subsidized participation in international trade fairs']",$5-8M annually,"12 months for program launch, ongoing operations","30% of new exporters under 35 years, 50% of all exporters are SMEs","['Youth-led export ventures: 300+ new businesses', 'SME export participation rate: 50%', 'Youth unemployment in export sector: <10%']","Limited experience, access to finance challenges","Structured mentorship, phased financing, partnership with established exporters"
MEDIUM,Digital Trade Facilitation,National Digital Trade Infrastructure and E-Commerce Platform,"Develop comprehensive digital infrastructure for export trade facilitation, documentation, and market access","Trade documentation and processes remain manual, causing delays and costs. Digital transformation can reduce time-to-export by 40%",Current export documentation takes 15-20 days; digital systems in comparable markets reduce this to 3-5 days,"['Rwanda Development Board (RDB)', 'Ministry of ICT and Innovation (MINICT)', 'Rwanda Revenue Authority (RRA)', 'Single Window Operators']","['Single digital platform for all export documentation', 'Blockchain-based supply chain transparency system', 'Mobile apps for real-time market prices and trade opportunities', 'AI-powered trade matching platform (buyers-sellers)', 'IoT sensors for agricultural export quality monitoring', 'E-certification and digital payment systems']","$15-20M for development, $2M annual operations",18-24 months for full deployment,"40% reduction in export processing time, 25% cost reduction","['Digital documentation adoption: 90% of exporters', 'Time-to-export: <5 days (from 15-20 days)', 'Trade matching platform users: 1,000+ exporters']","Technology adoption challenges, cybersecurity threats","User training programs, robust security architecture, phased rollout"
MEDIUM,Quality and Standards Compliance,Export Quality Infrastructure and Standards Compliance Program,Strengthen national quality infrastructure to meet international standards and reduce export rejections,Export rejections due to quality issues cost Rwanda $30-50M annually. Standards compliance opens premium markets,12-15% of agricultural exports face rejection or price penalties due to quality issues,"['Rwanda Standards Board (RSB)', 'National Agricultural Export Development Board (NAEB)', 'Ministry of Trade and Industry (MINICOM)', 'Exporters and Producers']","['ISO 17025 accredited testing laboratories expansion', 'International certification support (organic, fair trade, etc.)', 'Quality management training for producers and exporters', 'Traceability systems for high-value commodities', 'Subsidized quality certification for SMEs (70% cost coverage)']","$8-12M for infrastructure, $2M annual operations",12-18 months implementation,"Reduce export rejections to <5%, access to premium markets","['Export rejection rate: <5% (from 12-15%)', 'International certifications: 300+ businesses', 'Premium market access: 25% of exporters']","High compliance costs, changing international standards","Cost-sharing schemes, continuous monitoring of standards evolution"
